{
  "name": "Debug ALEEB Tarot Test",
  "description": "Debug test to check all pack slots for The Empress",
  "deck": "Red",
  "stake": "White",
  "must": [
    {
      "type": "TarotCard",
      "value": "TheEmpress",
      "antes": [1],
      "sources": {
        "packSlots": [0, 1, 2, 3]
      }
    }
  ],
  "should": [],
  "mustNot": []
}