{
  "name": "ALEEB TradingCard Slot 0 Test",
  "description": "Test if TradingCard matches with slot 0",
  "deck": "Red",
  "stake": "White",
  "must": [
    {
      "type": "Joker",
      "value": "TradingCard",
      "antes": [1],
      "sources": {
        "shopSlots": [0]
      }
    }
  ],
  "should": [],
  "mustNot": []
}