{
  "name": "ALEEB Simple Working Test",
  "description": "Test just Joker and Voucher",
  "deck": "Red",
  "stake": "White",
  "must": [
    {
      "type": "Joker",
      "value": "Blueprint",
      "antes": [2],
      "sources": {
        "shopSlots": [0, 1, 2, 3, 4, 5, 6, 7, 8, 9, 10, 11, 12, 13, 14, 15]
      }
    },
    {
      "type": "Voucher",
      "value": "Hieroglyph",
      "antes": [2]
    }
  ],
  "should": [],
  "mustNot": []
}