{
  "name": "ALEEB Blueprint Integration Test",
  "description": "Test that verifies Blueprint appears in Ante 2 shop slot 8 for seed ALEEB",
  "deck": "Red",
  "stake": "White",
  "must": [
    {
      "type": "Joker",
      "value": "Blueprint",
      "antes": [2],
      "sources": {
        "shopSlots": [0, 1, 2, 3, 4, 5, 6, 7, 8, 9]
      }
    }
  ],
  "should": [],
  "mustNot": []
}