{
    "name": "Burgle Me, Baby!",
    "description": "pifreak loves you! This filter configuration contains all the cards that pifreak loves.",
    "author": "pifreak",
    "must": [
        {
            "type": "Joker",
            "value": "Blueprint",
            "Antes": [1],
            "sources": {
                "packSlots": [0]
            }
        },
        {
            "type": "SpectralCard",
            "value": "Ankh",
            "Antes": [1],
            "sources": {
                "shopSlots": [0,1],
                "packSlots": [0,1]
            },
            "score": 1
        },
        {
            "type": "Joker",
            "value": "GreenJoker",
            "Antes": [1],
            "sources": {
                "shopSlots": [0,1]
            },
            "score": 1
        },
        {
            "type": "Joker",
            "value": "Burglar",
            "Antes": [2],
            "sources": {
                "shopSlots": [0,1,2,3,4,5,6,7],
                "packSlots": [0,1,2,3,4,5]
            }
        }
    ],
    "should": [
        {
            "type": "Joker",
            "value": "Supernova",
            "Antes": [2,3,4],
            "sources": {
                "shopSlots": [0,1,2,3,4,5,6,7],
                "packSlots": [0,1,2,3,4,5]
            }
        },
        {
            "type": "Joker",
            "value": "Splash",
            "Antes": [2,3,4],
            "sources": {
                "shopSlots": [0,1,2,3,4,5,6,7],
                "packSlots": [0,1,2,3,4,5]
            }
        },
        {
            "type": "Joker",
            "value": "Brainstorm",
            "Antes": [2,3,4,5],
            "sources": {
                "shopSlots": [2,3,4,5]
            },
            "score": 1
        },
        {
            "type": "Joker",
            "value": "GreenJoker",
            "Antes": [1],
            "sources": {
                "shopSlots": [0,1]
            },
            "score": 1
        },
        {
            "type": "Joker",
            "value": "Burglar",
            "Antes": [2],
            "sources": {
                "shopSlots": [0,1,2,3,4],
                "packSlots": [0,1,2,3]
            }
        },
        {
            "type": "Joker",
            "value": "Supernova",
            "Antes": [2,3],
            "sources": {
                "shopSlots": [0,1,2,3,4],
                "packSlots": [0,1,2,3]
            }
        },
        {
            "type": "Joker",
            "value": "Splash",
            "Antes": [2],
            "sources": {
                "shopSlots": [0,1,2,3,4],
                "packSlots": [0,1,2,3]
            }
        }
    ],
    "mustNot": [],
    "deck": "Anaglyph",
    "stake": "White"
}