{
  "name": "ALEEB Joker Category Test",
  "description": "Test that ALEEB matches Blueprint joker in Ante 2",
  "deck": "Red",
  "stake": "White",
  "must": [
    {
      "type": "Joker",
      "value": "Blueprint",
      "antes": [2],
      "sources": {
        "shopSlots": [7]
      }
    }
  ],
  "should": [],
  "mustNot": []
}
