{
  "name": "ALEEB Blueprint Slot 7 Only Test",
  "description": "Test if Blueprint matches with only slot 7",
  "deck": "Red",
  "stake": "White",
  "must": [
    {
      "type": "Joker",
      "value": "Blueprint",
      "antes": [2],
      "sources": {
        "shopSlots": [7]
      }
    }
  ],
  "should": [],
  "mustNot": []
}