{
  "name": "Debug ALEEB Soul Joker Test",
  "description": "Simple test to debug soul joker matching for ALEEB",
  "deck": "Ghost",
  "stake": "White",
  "must": [
    {
      "type": "SoulJoker",
      "value": "Perkeo",
      "antes": [1, 2, 3, 4, 5, 6, 7, 8]
    }
  ],
  "should": [],
  "mustNot": []
}