{
  "name": "ALEEB Planet Extended Test",
  "description": "Test Saturn with extended shop slots",
  "deck": "Red",
  "stake": "White",
  "must": [
    {
      "type": "PlanetCard",
      "value": "Saturn",
      "antes": [2],
      "sources": {
        "shopSlots": [0, 1, 2, 3, 4, 5, 6, 7, 8, 9, 10, 11, 12, 13, 14, 15, 16, 17, 18, 19, 20]
      }
    }
  ],
  "should": [],
  "mustNot": []
}